{"body":{"capabilities":["emit","verify"],"policy_hash_claimed":"5c11b6ce672a8976f1627a9e66a419b7064f2cf5af6197d3ac02aea8b368b9bc","uptime_seconds":600},"event_type":"watchtower.heartbeat.v1","header":{"device_id":"11111111-1111-1111-1111-111111111111","event_id":"aaaaaaaa-aaaa-aaaa-aaaa-aaaaaaaaaaaa","key_id":"lss-dev-ed25519","namespace":"watchtower/telemetry-heartbeat","prev_links":[],"producer":"lss-dev","producer_instance":"instance-a","producer_time":"2026-03-12T15:04:00Z","seq":1,"software_ref":{"kind":"build_id","value":"build-ok"}},"schema":"watchtower.telemetry_event.v1"}
