{"body":{"evidence_refs":[],"health_status":"ok","last_job":{"finished_time":"2026-03-12T15:04:00Z","job_id":"job-ok","result":"ok"},"posture":{"measurements":[{"key":"disk","value":"ok"},{"key":"queue","value":"ok"}],"schema":"watchtower.posture.v1"},"posture_hash":"17885bd484d28ac1adf3f4e1ae08d532fb2682f2d7d9667d685c26ae34e6da25","queue_status":{"inflight":0,"oldest_age_seconds":0,"pending":0},"signals":[{"key":"cpu","unit":"pct","value":"20"}],"storage_status":[{"free_bytes":1000000,"io_error":false,"mount":"C:","total_bytes":2000000}]},"event_type":"watchtower.health_report.v1","header":{"device_id":"11111111-1111-1111-1111-111111111111","event_id":"bbbbbbbb-bbbb-bbbb-bbbb-bbbbbbbbbbbb","key_id":"lss-dev-ed25519","namespace":"watchtower/telemetry-health","prev_links":[],"producer":"lss-dev","producer_instance":"instance-a","producer_time":"2026-03-12T15:04:10Z","seq":2,"software_ref":{"kind":"build_id","value":"build-ok"}},"schema":"watchtower.telemetry_event.v1"}
