{"body":{"compliance":"noncompliant","effective_group":"default","policy":{"policy_id":"policy-bad","policy_version":"v1","rules_hash":"cccccccccccccccccccccccccccccccccccccccccccccccccccccccccccccccc","schema":"covenantgate.effective_policy.v1"},"policy_hash_claimed":"b1c12ccdc60d1578c9baf2f8a3fb5c3d683826b4f675e4cfd2e8f0ff2e5ea564","policy_source_ref":{"kind":"sha256","value":"b1c12ccdc60d1578c9baf2f8a3fb5c3d683826b4f675e4cfd2e8f0ff2e5ea564"},"posture_hash":"6cc5d3738dbdd22884aa8d2c2c371324f34f92fd1cdb6834af2e6f9718c8b532","violations":[{"code":"POLICY_HASH_MISMATCH","evidence":[{"kind":"sha256","value":"b1c12ccdc60d1578c9baf2f8a3fb5c3d683826b4f675e4cfd2e8f0ff2e5ea564"}],"severity":"high"}]},"event_type":"watchtower.policy_attest.v1","header":{"device_id":"33333333-3333-3333-3333-333333333333","event_id":"ffffffff-ffff-ffff-ffff-ffffffffffff","key_id":"lss-dev-ed25519","namespace":"watchtower/telemetry-policy","prev_links":[],"producer":"lss-dev","producer_instance":"instance-c","producer_time":"2026-03-12T15:04:10Z","seq":2,"software_ref":{"kind":"build_id","value":"build-drift"}},"schema":"watchtower.telemetry_event.v1"}
